{
  "schema_version": "track-registry-v1",
  "purpose": "Declare every bounded scientific track, its evidence level, open gates, source-rights state, human-review state, and release boundary in one auditable registry.",
  "status": "bounded-engineering-registry",
  "global_boundaries": {
    "claim_status": "unverified",
    "execution_allowed": false,
    "real_data": false,
    "research_candidate": false,
    "public_release_allowed": false,
    "scientific_validity": false,
    "publication_ready": false
  },
  "tracks": [
    {
      "track_id": "T1",
      "acceptance": "artifacts/acceptance.json",
      "state": "reproduced-within-scope",
      "evidence_level": "validated-reproduction",
      "claim_status": "unverified",
      "execution_allowed": false,
      "real_data": false,
      "research_candidate": false,
      "public_release": false,
      "source_rights_status": "partially-reviewed",
      "human_review_status": "not-completed",
      "open_gates": [
        "external symbolic engine",
        "mission-domain force and maneuver comparison",
        "preregistered mission holdout and uncertainty review"
      ],
      "next_step": "obtain an independently documented cruise force and maneuver history or radiometric product with coverage of the fixed arcs; replace the generic solar-radiation-pressure sensitivity grid with reviewed mission plate/attitude/mass/optical data and an uncertainty model without promoting reconstructed NAV endpoints to scientific holdout",
      "required_receipts": [
        "artifacts/acceptance.json",
        "artifacts/sample-run.json",
        "artifacts/t1-combined-cli-audit-v4.json",
        "artifacts/t1-core-orbit-run-audit.json",
        "docs/T1_MAVEN_MISSION_SOURCE.md"
      ],
      "acceptance_contract": "root-v1",
      "evaluator_id": "hohmann-bounded-generator-v1",
      "problem": {
        "question": "Does the bounded formula search reproduce Hohmann transfer time and dimension checks on analytic fixtures?",
        "observables": [
          {
            "name": "transfer_time",
            "unit": "s"
          },
          {
            "name": "semimajor_axis",
            "unit": "m"
          },
          {
            "name": "solar_mu",
            "unit": "m^3/s^2"
          }
        ],
        "candidate_space": {
          "families": [
            "bounded semimajor-axis expressions"
          ],
          "max_candidates": 128
        },
        "baselines": [
          "analytic Hohmann formula",
          "two-body numerical propagation"
        ],
        "evaluation_scope": "Synthetic circular coplanar two-body fixtures; mission source inventories are separate engineering evidence.",
        "holdout": {
          "status": "analytic-fixture-only",
          "split_unit": "fixture orbit case",
          "limitations": "No independent mission holdout or reviewed force/uncertainty model."
        },
        "stop_conditions": [
          "Reject evidence or acceptance fingerprint mismatch",
          "Stop before real-data or scientific claim promotion",
          "Reject candidate registration beyond the declared ceiling; this ceiling does not dispatch tools"
        ]
      },
      "review_evidence": {
        "source_rights": [
          "docs/T1_MAVEN_MISSION_SOURCE.md"
        ],
        "human_review": []
      }
    },
    {
      "track_id": "T2",
      "acceptance": "artifacts/t2-causal/acceptance.json",
      "state": "reproduced-within-scope",
      "evidence_level": "validated-reproduction",
      "claim_status": "unverified",
      "execution_allowed": false,
      "real_data": false,
      "research_candidate": false,
      "public_release": false,
      "source_rights_status": "unresolved",
      "human_review_status": "not-completed",
      "open_gates": [
        "real interventions",
        "causal identification",
        "data rights",
        "external algorithm source rights",
        "measurement-column semantics and 30/82 coverage",
        "preregistered trial-level model comparison and holdout"
      ],
      "next_step": "resolve the measured workbook's v0 semantics and 30/82 experiment coverage; review supplement rights, then preregister a trial-level physical-model comparison and seek real intervention data for causal identification",
      "required_receipts": [
        "artifacts/t2-causal/acceptance.json",
        "artifacts/t2-physical/acceptance.json",
        "artifacts/t2-projectile-source-audit.json",
        "artifacts/t2-causal-sensitivity-audit.json",
        "docs/T2_PROJECTILE_MODEL_PROTOCOL.json",
        "docs/T2_PROJECTILE_SOURCE_CONTRACT.json"
      ],
      "acceptance_contract": "track-v1",
      "evaluator_id": "causal-intervention-v1",
      "problem": {
        "question": "Can declared physical and causal candidates pass synthetic holdout and reject context leakage?",
        "observables": [
          {
            "name": "position",
            "unit": "m"
          },
          {
            "name": "time",
            "unit": "s"
          },
          {
            "name": "velocity",
            "unit": "m/s"
          },
          {
            "name": "causal_fixture_outcome",
            "unit": "1"
          }
        ],
        "candidate_space": {
          "families": [
            "synthetic linear intervention models",
            "projectile physical models"
          ],
          "max_candidates": 64
        },
        "baselines": [
          "synthetic structural equation",
          "no-drag projectile model"
        ],
        "evaluation_scope": "Synthetic fixture comparison; projectile source inventory does not admit measured columns for model fitting.",
        "holdout": {
          "status": "synthetic-fixture-only",
          "split_unit": "fixture case; prospective whole trial",
          "limitations": "Measured v0 semantics and 30/82 coverage remain unresolved; no real causal identification."
        },
        "stop_conditions": [
          "Reject evidence or acceptance fingerprint mismatch",
          "Stop before real-data or scientific claim promotion",
          "Reject candidate registration beyond the declared ceiling; this ceiling does not dispatch tools"
        ]
      },
      "review_evidence": {
        "source_rights": [
          "docs/T2_PROJECTILE_SOURCE_CONTRACT.json"
        ],
        "human_review": []
      }
    },
    {
      "track_id": "T3",
      "acceptance": "artifacts/t3-dynamics/acceptance.json",
      "state": "reproduced-within-scope",
      "evidence_level": "validated-reproduction",
      "claim_status": "unverified",
      "execution_allowed": false,
      "real_data": false,
      "research_candidate": false,
      "public_release": false,
      "source_rights_status": "partially-reviewed",
      "human_review_status": "not-completed",
      "open_gates": [
        "long-horizon/nonintegrable multi-body validation",
        "real-mission provenance",
        "long-horizon compute budget"
      ],
      "next_step": "seek high-precision long-time convergence beyond the close-approach guard and a rights-cleared mission comparison; do not infer chaos validation from finite trajectory agreement",
      "required_receipts": [
        "artifacts/t3-dynamics/acceptance.json",
        "artifacts/t3-nbody/acceptance.json",
        "artifacts/t3-horizon-grid-audit.json",
        "artifacts/t3-perturbed-run-audit.json",
        "artifacts/t3-figure-eight-audit.json"
      ],
      "acceptance_contract": "track-v1",
      "evaluator_id": "harmonic-dynamics-v2",
      "problem": {
        "question": "Do bounded dynamics implementations agree with declared baselines over finite guarded horizons?",
        "observables": [
          {
            "name": "position",
            "unit": "m"
          },
          {
            "name": "velocity",
            "unit": "m/s"
          },
          {
            "name": "time",
            "unit": "s"
          },
          {
            "name": "normalized_nbody_position",
            "unit": "1"
          }
        ],
        "candidate_space": {
          "families": [
            "Verlet and RK4 finite trajectories",
            "bounded independent solver comparisons"
          ],
          "max_candidates": 64
        },
        "baselines": [
          "analytic harmonic oscillator",
          "published normalized figure-eight orbit"
        ],
        "evaluation_scope": "Synthetic oscillator and normalized n-body benchmarks with finite horizon and close-approach guards.",
        "holdout": {
          "status": "synthetic-fixture-only",
          "split_unit": "initial condition and integration horizon",
          "limitations": "Finite trajectory agreement does not establish chaos, long-time stability, or mission validation."
        },
        "stop_conditions": [
          "Reject evidence or acceptance fingerprint mismatch",
          "Stop before real-data or scientific claim promotion",
          "Reject candidate registration beyond the declared ceiling; this ceiling does not dispatch tools"
        ]
      },
      "review_evidence": {
        "source_rights": [
          "artifacts/t3-figure-eight-audit.json"
        ],
        "human_review": []
      }
    },
    {
      "track_id": "T4",
      "acceptance": "artifacts/t4-proof/acceptance.json",
      "state": "reproduced-within-scope",
      "evidence_level": "validated-reproduction",
      "claim_status": "unverified",
      "execution_allowed": false,
      "real_data": false,
      "research_candidate": false,
      "public_release": false,
      "source_rights_status": "partially-reviewed",
      "human_review_status": "not-completed",
      "open_gates": [
        "general formal proof backend",
        "reviewed physical transition model",
        "real-world validation"
      ],
      "next_step": "review a physical model and add independent source-backed validation",
      "required_receipts": [